Line Number,msgid,msgstr,Status
11482,""Salary Slips already exist for employees {}, and will not be processed by this payroll."",""มีสลิปเงินเดือนสำหรับพนักงาน {} อยู่แล้ว และจะไม่ถูกประมวลผลโดยบัญชีเงินเดือนนี้"",Translated
11498,"Salary Slips submitted for period from {0} to {1}","สลิปเงินเดือนที่ส่งสำหรับช่วงเวลาจาก {0} ถึง {1}",Translated
11506,"Salary Structure","โครงสร้างเงินเดือน",Translated
11510,"Salary Structure Assignment","การกำหนดโครงสร้างเงินเดือน",Translated
11514,"Salary Structure Assignment field","ฟิลด์การกำหนดโครงสร้างเงินเดือน",Translated
11518,"Salary Structure Assignment for Employee already exists","มีรายการกำหนดโครงสร้างเงินเดือนสำหรับพนักงานนี้อยู่แล้ว",Translated
11522,"Salary Structure Missing","ไม่มีโครงสร้างเงินเดือน",Translated
11526,"Salary Structure must be submitted before submission of {0}","ต้องส่งโครงสร้างเงินเดือนก่อนที่จะส่ง {0}",Translated
11530,"Salary Structure not found for employee {0} and date {1}","ไม่พบโครงสร้างเงินเดือนสำหรับพนักงาน {0} และวันที่ {1}",Translated
11534,"Salary Structure should have flexible benefit component(s) to dispense benefit amount","โครงสร้างเงินเดือนควรมีองค์ประกอบสวัสดิการที่ยืดหยุ่นเพื่อจ่ายจำนวนเงินสวัสดิการ",Translated
11538,"Salary Structure {0} does not belong to company {1}","โครงสร้างเงินเดือน {0} ไม่ได้เป็นของบริษัท {1}",Translated
11547,"Salary Structures updated successfully","อัปเดตโครงสร้างเงินเดือนสำเร็จแล้ว",Translated
11554,"Salary Withholding","การระงับเงินเดือน",Translated
11558,"Salary Withholding Cycle","รอบการระงับเงินเดือน",Translated
11562,"Salary Withholding {0} already exists for employee {1} for the selected period","มีรายการระงับเงินเดือน {0} สำหรับพนักงาน {1} ในช่วงเวลาที่เลือกแล้ว",Translated
11568,""Salary already processed for period between {0} and {1}, Leave application period cannot be between this date range."",""เงินเดือนสำหรับช่วงเวลาระหว่าง {0} ถึง {1} ได้ถูกประมวลผลแล้ว ช่วงเวลาของใบลาไม่สามารถอยู่ระหว่างช่วงวันที่นี้ได้"",Translated
11574,"Salary breakup based on Earning and Deduction.","การแจกแจงเงินเดือนตามรายรับและรายการหัก",Translated
11578,"Salary components should be part of the Salary Structure.","องค์ประกอบเงินเดือนควรเป็นส่วนหนึ่งของโครงสร้างเงินเดือน",Translated
11582,"Salary slip emails have been enqueued for sending. Check {0} for status.","อีเมลสลิปเงินเดือนได้เข้าคิวเพื่อรอส่งแล้ว ตรวจสอบสถานะที่ {0}",Translated
11586,"Sales Invoice","ใบแจ้งหนี้ขาย",Translated
11591,"Same Company is entered more than once","บริษัทเดียวกันถูกป้อนมากกว่าหนึ่งครั้ง",Translated
11598,"Sanctioned","ได้รับอนุมัติ",Translated
11602,"Sanctioned Amount","จำนวนเงินที่อนุมัติ",Translated
11607,"Sanctioned Amount cannot be greater than Claim Amount in Row {0}.","จำนวนเงินที่อนุมัติไม่สามารถมากกว่าจำนวนเงินที่เบิกในแถวที่ {0} ได้",Translated
11616,"Saturday","วันเสาร์",Translated
11621,"Scheduled","ตามกำหนดการ",Translated
11626,"Scheduled On","กำหนดการในวันที่",Translated
11631,"Score (0-5)","คะแนน (0-5)",Translated
11635,"Score Earned","คะแนนที่ได้รับ",Translated
11639,"Score must be less than or equal to 5","คะแนนต้องน้อยกว่าหรือเท่ากับ 5",Translated
11643,"Scores","คะแนน",Translated
11648,"Search for Jobs","ค้นหางาน",Translated
11664,"Select Company","เลือกบริษัท",Translated
11668,"Select Employees","เลือกพนักงาน",Translated
11672,"Select Interview Round First","เลือกรอบสัมภาษณ์ก่อน",Translated
11677,"Select Interview first","เลือกการสัมภาษณ์ก่อน",Translated
11681,"Select Payment Account to make Bank Entry","เลือกบัญชีการชำระเงินเพื่อสร้างรายการธนาคาร",Translated
11685,"Select Payroll Frequency.","เลือกความถี่ในการจ่ายเงินเดือน",Translated
11689,"Select Payroll Period","เลือกรอบการจ่ายเงินเดือน",Translated
11693,"Select Property","เลือกคุณสมบัติ",Translated
11698,"Select Shift Requests","เลือกคำขอกะ",Translated
11704,"Select Terms and Conditions","เลือกข้อกำหนดและเงื่อนไข",Translated
11708,"Select Users","เลือกผู้ใช้",Translated
11712,"Select an employee to get the employee advance.","เลือกพนักงานเพื่อรับเงินทดรองของพนักงาน",Translated
11716,"Select the Employee for which you want to allocate leaves.","เลือกพนักงานที่คุณต้องการจัดสรรวันลาให้",Translated
11720,"Select the Employee.","เลือกพนักงาน",Translated
11724,""Select the Leave Type like Sick leave, Privilege Leave, Casual Leave, etc."",""เลือกประเภทการลา เช่น ลาป่วย, สิทธิ์การลาพักร้อน, ลากิจ เป็นต้น"",Translated
11728,"Select the date after which this Leave Allocation will expire.","เลือกวันที่ซึ่งการจัดสรรวันลานี้จะหมดอายุ",Translated
11732,"Select the date from which this Leave Allocation will be valid.","เลือกวันที่ซึ่งการจัดสรรวันลานี้จะมีผลบังคับใช้",Translated
11736,"Select the end date for your Leave Application.","เลือกวันที่สิ้นสุดสำหรับใบลาของคุณ",Translated
11742,"Select the start date for your Leave Application.","เลือกวันที่เริ่มต้นสำหรับใบลาของคุณ",Translated
11746,"Select this if you want shift assignments to be automatically created indefinitely.","เลือกตัวเลือกนี้หากคุณต้องการให้การมอบหมายกะถูกสร้างขึ้นโดยอัตโนมัติอย่างไม่มีกำหนด",Translated
11750,""Select type of leave the employee wants to apply for, like Sick Leave, Privilege Leave, Casual Leave, etc."",""เลือกประเภทการลาที่พนักงานต้องการสมัคร เช่น ลาป่วย, สิทธิ์การลาพักร้อน, ลากิจ เป็นต้น"",Translated
11755,"Select your Leave Approver i.e. the person who approves or rejects your leaves.","เลือกผู้อนุมัติการลาของคุณ คือบุคคลที่อนุมัติหรือปฏิเสธการลาของคุณ",Translated
11761,"Select {0}","เลือก {0}",Translated
11765,"Self Appraisal","การประเมินตนเอง",Translated
11769,"Self Appraisal Pending: {0}","การประเมินตนเองที่รอดำเนินการ: {0}",Translated
11774,"Self Appraisal Score","คะแนนการประเมินตนเอง",Translated
11779,"Self Score","คะแนนตนเอง",Translated
11783,"Self-Study","การเรียนรู้ด้วยตนเอง",Translated
11788,"Self-approval for leaves is not allowed","ไม่อนุญาตให้มีการอนุมัติการลาของตนเอง",Translated
11794,"Seminar","สัมมนา",Translated
11798,"Send Emails At","ส่งอีเมลเวลา",Translated
11802,"Send Exit Questionnaire","ส่งแบบสอบถามก่อนลาออก",Translated
11808,"Send Exit Questionnaires","ส่งแบบสอบถามก่อนลาออก",Translated
11813,"Send Interview Feedback Reminder","ส่งการแจ้งเตือนข้อเสนอแนะการสัมภาษณ์",Translated
11818,"Send Interview Reminder","ส่งการแจ้งเตือนการสัมภาษณ์",Translated
11826,"Send Leave Notification","ส่งการแจ้งเตือนการลา",Translated
11834,"Sender","ผู้ส่ง",Translated
11838,"Sender Email","อีเมลผู้ส่ง",Translated
11843,"Sending Failed due to missing email information for employee(s): {1}","การส่งล้มเหลวเนื่องจากข้อมูลอีเมลของพนักงานหายไป: {1}",Translated
11847,"Sent","ส่งแล้ว",Translated
11852,"Sent Successfully: {0}","ส่งสำเร็จ: {0}",Translated
11858,"Sep","ก.ย.",Translated
11864,"Separation Activities","กิจกรรมการพ้นสภาพ",Translated
11883,"Separation Begins On","การพ้นสภาพเริ่มในวันที่",Translated
11888,"Series","ชุด",Translated
11893,"Service","บริการ",Translated
11897,"Service Details","รายละเอียดบริการ",Translated
11901,"Service Expense","ค่าใช้จ่ายบริการ",Translated
11908,"Service Expenses","ค่าใช้จ่ายบริการ",Translated
11914,"Service Item","รายการบริการ",Translated
11920,""Set \""From(Year)\"" and \""To(Year)\"" to 0 for no upper and lower limit."",""ตั้งค่า \""จาก(ปี)\"" และ \""ถึง(ปี)\"" เป็น 0 หากไม่มีขีดจำกัดบนและล่าง"",Translated
11926,"Set Assignment Details","ตั้งค่ารายละเอียดการมอบหมาย",Translated
11930,"Set Leave Details","ตั้งค่ารายละเอียดการลา",Translated
11936,"Set Relieving Date for Employee: {0}","ตั้งค่าวันที่พ้นสภาพสำหรับพนักงาน: {0}",Translated
11942,"Set filters to fetch employees","ตั้งค่าตัวกรองเพื่อดึงข้อมูลพนักงาน",Translated
11948,"Set opening balances for earnings and taxes from the previous employer","ตั้งค่ายอดยกมาสำหรับรายรับและภาษีจากนายจ้างคนก่อน",Translated
11952,"Set optional filters to fetch employees in the appraisee list","ตั้งค่าตัวกรองเสริมเพื่อดึงข้อมูลพนักงานในรายชื่อผู้ถูกประเมิน",Translated
11957,"Set the default account for the {0} {1}","ตั้งค่าบัญชีเริ่มต้นสำหรับ {0} {1}",Translated
11963,"Set the frequency for holiday reminders","ตั้งค่าความถี่สำหรับการแจ้งเตือนวันหยุด",Translated
11967,"Set the properties that should be updated in the Employee master on promotion submission","ตั้งค่าคุณสมบัติที่ควรได้รับการอัปเดตในข้อมูลหลักของพนักงานเมื่อมีการส่งการเลื่อนตำแหน่ง",Translated
11971,"Set the status to {0} if required.","ตั้งค่าสถานะเป็น {0} หากจำเป็น",Translated
11981,"Set {0} for selected employees","ตั้งค่า {0} สำหรับพนักงานที่เลือก",Translated
11985,"Settings","การตั้งค่า",Translated
11989,"Settings Missing","ไม่มีการตั้งค่า",Translated
11993,"Settle against Advances","ชำระเงินทดรอง",Translated
11999,"Settle all Payables and Receivables before submission","ชำระเจ้าหนี้และลูกหนี้ทั้งหมดก่อนส่ง",Translated
12006,"Settled","ตกลงแล้ว",Translated
12010,"Setup","การตั้งค่า",Translated
12028,"Shared document with the user {0} with 'Submit' permission","แบ่งปันเอกสารกับผู้ใช้ {0} พร้อมสิทธิ์ 'ส่ง'",Translated
12033,"Shift","กะ",Translated
12038,"Shift & Attendance","กะและการเข้างาน",Translated
12042,"Shift Actual End","เวลาสิ้นสุดกะจริง",Translated
12048,"Shift Actual End Time","เวลาสิ้นสุดกะจริง",Translated
12052,"Shift Actual Start","เวลาเริ่มต้นกะจริง",Translated
12059,"Shift Actual Start Time","เวลาเริ่มต้นกะจริง",Translated
12065,"Shift Assignment","การมอบหมายกะ",Translated
12069,"Shift Assignment Details","รายละเอียดการมอบหมายกะ",Translated
12077,"Shift Assignment History","ประวัติการมอบหมายกะ",Translated
12081,"Shift Assignment Tool","เครื่องมือมอบหมายกะ",Translated
12088,"Shift Assignment: {0} created for Employee: {1}","การมอบหมายกะ: {0} ถูกสร้างขึ้นสำหรับพนักงาน: {1}",Translated
12097,"Shift Attendance","การเข้างานตามกะ",Translated
12102,"Shift Details","รายละเอียดกะ",Translated
12106,"Shift End","สิ้นสุดกะ",Translated
12120,"Shift End Time","เวลาสิ้นสุดกะ",Translated
12131,"Shift Location","ที่ตั้งของกะ",Translated
12135,"Shift Request","คำขอกะ",Translated
12141,"Shift Request Approver","ผู้อนุมัติคำขอกะ",Translated
12147,"Shift Request Filters","ตัวกรองคำขอกะ",Translated
12152,"Shift Requests ending before this date will be excluded.","คำขอกะที่สิ้นสุดก่อนวันที่นี้จะถูกตัดออก",Translated
12164,"Shift Requests starting after this date will be excluded.","คำขอกะที่เริ่มต้นหลังวันที่นี้จะถูกตัดออก",Translated
12174,"Shift Schedule","ตารางกะ",Translated
12180,"Shift Schedule Assignment","การกำหนดตารางกะ",Translated
12185,"Shift Settings","การตั้งค่ากะ",Translated
12189,"Shift Start","เริ่มต้นกะ",Translated
12195,"Shift Start Time","เวลาเริ่มต้นกะ",Translated
12201,"Shift Status","สถานะกะ",Translated
12206,"Shift Timings","ช่วงเวลาของกะ",Translated
12227,"Shift Tools","เครื่องมือกะ",Translated
12231,"Shift Type","ประเภทกะ",Translated
12236,"Shift has been successfully updated to {0}.","อัปเดตกะเป็น {0} สำเร็จแล้ว",Translated
12240,"Shifts","กะ",Translated
12246,"Show Employee","แสดงพนักงาน",Translated
12252,"Show Leave Balances in Salary Slip","แสดงยอดวันลาคงเหลือในสลิปเงินเดือน",Translated
12256,"Show Leaves Of All Department Members In Calendar","แสดงการลาของสมาชิกทุกคนในแผนกในปฏิทิน",Translated
12260,"Show Salary Slip","แสดงสลิปเงินเดือน",Translated
12264,"Showing","กำลังแสดง",Translated
12268,"Sick Leave","ลาป่วย",Translated
12281,"Single Assignment","การมอบหมายเดี่ยว",Translated
12290,"Skill","ทักษะ",Translated
12295,"Skill Assessment","การประเมินทักษะ",Translated
12301,"Skill Name","ชื่อทักษะ",Translated
12307,"Skills","ทักษะ",Translated
12311,"Skip Auto Attendance","ข้ามการบันทึกการเข้างานอัตโนมัติ",Translated
12318,""Skipping Salary Structure Assignment for the following employees, as Salary Structure Assignment records already exists against them. {0}"",""ข้ามการกำหนดโครงสร้างเงินเดือนสำหรับพนักงานต่อไปนี้ เนื่องจากมีบันทึกการกำหนดโครงสร้างเงินเดือนอยู่แล้ว {0}"",Translated
12325,"Source","แหล่งที่มา",Translated
12331,"Source Name","ชื่อแหล่งที่มา",Translated
12335,"Source and Rating","แหล่งที่มาและการให้คะแนน",Translated
12341,"Source and target shifts cannot be the same","กะต้นทางและเป้าหมายไม่สามารถเป็นกะเดียวกันได้",Translated
12346,"Sponsored Amount","จำนวนเงินที่สนับสนุน",Translated
12356,"Staffing Details","รายละเอียดการจัดหาบุคลากร",Translated
12361,"Staffing Plan","แผนการจัดหาบุคลากร",Translated
12365,"Staffing Plan Detail","รายละเอียดแผนการจัดหาบุคลากร",Translated
12374,"Staffing Plan {0} already exist for designation {1}","แผนการจัดหาบุคลากร {0} มีอยู่แล้วสำหรับตำแหน่ง {1}",Translated
12381,"Standard Tax Exemption Amount","จำนวนเงินยกเว้นภาษีมาตรฐาน",Translated
12387,"Standard Working Hours","ชั่วโมงทำงานมาตรฐาน",Translated
12412,"Start","เริ่ม",Translated
12421,"Start Date","วันที่เริ่มต้น",Translated
12425,"Start Time","เวลาเริ่มต้น",Translated
12429,""Start and end dates not in a valid Payroll Period, cannot calculate {0}"",""วันที่เริ่มต้นและสิ้นสุดไม่อยู่ในรอบการจ่ายเงินเดือนที่ถูกต้อง ไม่สามารถคำนวณ {0} ได้"",Translated
12433,""Start and end dates not in a valid Payroll Period, cannot calculate {0}."",""วันที่เริ่มต้นและสิ้นสุดไม่อยู่ในรอบการจ่ายเงินเดือนที่ถูกต้อง ไม่สามารถคำนวณ {0} ได้"",Translated
12437,"Start date: {0}","วันที่เริ่มต้น: {0}",Translated
12445,"Start time and end time cannot be same.","เวลาเริ่มต้นและเวลาสิ้นสุดไม่สามารถเป็นเวลาเดียวกันได้",Translated
12522,"Statistical Component","องค์ประกอบทางสถิติ",Translated
12530,"Status","สถานะ",Translated
12534,"Status for Other Half","สถานะสำหรับอีกครึ่งวัน",Translated
12540,"Stock Options","สิทธิซื้อหุ้น",Translated
12546,"Stop users from making Leave Applications on following days.","หยุดผู้ใช้ไม่ให้ยื่นใบลาในวันต่อไปนี้",Translated
12550,"Strictly based on Log Type in Employee Checkin","อ้างอิงตามประเภทบันทึกในการบันทึกเวลาเข้างานของพนักงานอย่างเคร่งครัด",Translated
12557,"Structures have been assigned successfully","กำหนดโครงสร้างสำเร็จแล้ว",Translated
12563,"Subject","หัวข้อ",Translated
12567,"Submission Date","วันที่ส่ง",Translated
12571,"Submission Failed","การส่งล้มเหลว",Translated
12577,"Submission of {0} before {1} is not allowed","ไม่อนุญาตให้ส่ง {0} ก่อน {1}",Translated
12583,"Submit","ส่ง",Translated
12587,"Submit Feedback","ส่งข้อเสนอแนะ",Translated
12591,"Submit Now","ส่งทันที",Translated
12595,"Submit Proof","ส่งหลักฐาน",Translated
12599,"Submit Salary Slip","ส่งสลิปเงินเดือน",Translated
12603,"Submit this Leave Application to confirm.","ส่งใบลาเพื่อยืนยัน",Translated
12616,"Submit this to create the Employee record","ส่งเพื่อสร้างบันทึกพนักงาน",Translated
12620,"Submitted","ส่งแล้ว",Translated
12624,"Submitting Salary Slips and creating Journal Entry...","กำลังส่งสลิปเงินเดือนและสร้างรายการสมุดรายวัน...",Translated
12628,"Submitting Salary Slips...","กำลังส่งสลิปเงินเดือน...",Translated
12641,"Subsidiary companies have already planned for {1} vacancies at a budget of {2}. Staffing Plan for {0} should allocate more vacancies and budget for {3} than planned for its subsidiary companies","บริษัทในเครือได้วางแผนสำหรับตำแหน่งงานว่าง {1} ตำแหน่งด้วยงบประมาณ {2} แล้ว แผนการจัดหาบุคลากรสำหรับ {0} ควรกำหนดตำแหน่งงานว่างและงบประมาณสำหรับ {3} มากกว่าที่วางแผนไว้สำหรับบริษัทในเครือ",Translated
12645,"Success","สำเร็จ",Translated
12649,"Successfully created {0} for employees:","สร้าง {0} สำหรับพนักงานสำเร็จ:",Translated
12655,"Successfully {0} {1} for the following employees:","{0} {1} สำเร็จสำหรับพนักงานต่อไปนี้:",Translated
12659,"Sum of all previous slabs","ผลรวมของทุกขั้นก่อนหน้า",Translated
12664,"Summarized View","มุมมองสรุป",Translated
12673,"Sunday","วันอาทิตย์",Translated
12679,"Supplier","ผู้จัดจำหน่าย",Translated
12683,"Suspended","ถูกระงับ",Translated
12687,"Sync {0}","ซิงค์ {0}",Translated
12691,"Syntax error","ข้อผิดพลาดทางไวยากรณ์",Translated
12748,"Syntax error in condition: {0} in Income Tax Slab","ข้อผิดพลาดทางไวยากรณ์ในเงื่อนไข: {0} ในขั้นภาษีเงินได้",Translated
12754,"System Manager","ผู้จัดการระบบ",Translated
12763,"Take Exact Completed Years","นับปีที่เสร็จสมบูรณ์พอดี",Translated
12769,"Task","งาน",Translated
12774,"Task Weight","น้ำหนักงาน",Translated
