Line Number,msgid,msgstr,Status
8179,"Letter Head","หัวจดหมาย",Translated
8184,"Level","ระดับ",Translated
8188,"License Plate","ป้ายทะเบียน",Translated
8193,"Lifecycle","วงจรการทำงาน",Translated
8199,"Lime","สีเขียวมะนาว",Translated
8203,"Link the cycle and tag KRA to your goal to update the appraisal's goal score based on the goal progress","เชื่อมโยงรอบและแท็ก KRA กับเป้าหมายของคุณเพื่ออัปเดตคะแนนเป้าหมายการประเมินตามความคืบหน้าของเป้าหมาย",Translated
8207,"Linked Project {} and Tasks deleted.","โครงการที่เชื่อมโยง {} และงานต่างๆ ถูกลบแล้ว",Translated
8212,"Load more","โหลดเพิ่มเติม",Translated
8217,"Loan","เงินกู้",Translated
8222,"Loan Account","บัญชีเงินกู้",Translated
8226,"Loan Product","ผลิตภัณฑ์สินเชื่อ",Translated
8231,"Loan Repayment","การชำระคืนเงินกู้",Translated
8235,"Loan Repayment Entry","รายการชำระคืนเงินกู้",Translated
8239,"Loan cannot be repayed from salary for Employee {0} because salary is processed in currency {1}","ไม่สามารถชำระคืนเงินกู้จากเงินเดือนสำหรับพนักงาน {0} ได้ เนื่องจากเงินเดือนถูกประมวลผลในสกุลเงิน {1}",Translated
8251,"Locating...","กำลังระบุตำแหน่ง...",Translated
8256,"Location","ที่ตั้ง",Translated
8261,"Location / Device ID","ที่ตั้ง / รหัสอุปกรณ์",Translated
8266,"Location Name","ชื่อที่ตั้ง",Translated
8270,"Lodging Required","ต้องการที่พัก",Translated
8276,"Log Out","ออกจากระบบ",Translated
8280,"Log Type","ประเภทบันทึก",Translated
8284,"Log Type is required for check-ins falling in the shift: {0}.","ประเภทบันทึกเป็นสิ่งจำเป็นสำหรับการบันทึกเวลาเข้าที่อยู่ในกะ: {0}",Translated
8288,"Login","เข้าสู่ระบบ",Translated
8292,"Login Failed","เข้าสู่ระบบล้มเหลว",Translated
8299,"Login to Frappe HR","เข้าสู่ระบบ Frappe HR",Translated
8303,"Longitude","ลองจิจูด",Translated
8310,"Longitude: {0}°","ลองจิจูด: {0}°",Translated
8314,"Lower Range","ช่วงค่าที่ต่ำกว่า",Translated
8320,"MICR","MICR",Translated
8324,"Make","สร้าง",Translated
8331,"Make Bank Entry","สร้างรายการธนาคาร",Translated
8335,"Mandatory","จำเป็น",Translated
8339,"Mandatory fields required for this action:","ฟิลด์ที่จำเป็นสำหรับการดำเนินการนี้:",Translated
8345,"Mandatory fields required in {0}","ฟิลด์ที่จำเป็นใน {0}",Translated
8351,"Manual","คู่มือ",Translated
8356,"Manual Rating","การให้คะแนนด้วยตนเอง",Translated
8364,"Mar","มี.ค.",Translated
8370,"Mark Attendance","บันทึกการเข้างาน",Translated
8374,"Mark Auto Attendance on Holidays","บันทึกการเข้างานอัตโนมัติในวันหยุด",Translated
8381,"Mark all as read","ทำเครื่องหมายทั้งหมดว่าอ่านแล้ว",Translated
8385,"Mark as Completed","ทำเครื่องหมายว่าเสร็จสมบูรณ์",Translated
8389,"Mark as In 
Progress","ทำเครื่องหมายว่ากำลังดำเนินการ",Translated
8393,"Mark as {0}","ทำเครื่องหมายเป็น {0}",Translated
8399,"Mark attendance as {0} for {1} on selected dates?","บันทึกการเข้างานเป็น {0} สำหรับ {1} ในวันที่ที่เลือกหรือไม่?",Translated
8403,"Mark attendance based on 'Employee Checkin' for Employees assigned to this shift.","บันทึกการเข้างานตาม 'การบันทึกเวลาเข้างานของพนักงาน' สำหรับพนักงานที่ได้รับมอบหมายในกะนี้",Translated
8407,"Mark attendance for existing check-in/out logs before changing shift settings","บันทึกการเข้างานสำหรับบันทึกเวลาเข้า/ออกที่มีอยู่ก่อนที่จะเปลี่ยนการตั้งค่ากะ",Translated
8411,"Mark {0} as Completed?","ทำเครื่องหมาย {0} ว่าเสร็จสมบูรณ์หรือไม่?",Translated
8417,"Mark {0} {1} as {2}?","ทำเครื่องหมาย {0} {1} เป็น {2} หรือไม่?",Translated
8423,"Marked Attendance","การเข้างานที่บันทึกแล้ว",Translated
8427,"Marked Attendance HTML","HTML การเข้างานที่บันทึกแล้ว",Translated
8434,"Marking Attendance","กำลังบันทึกการเข้างาน",Translated
8440,"Masters","ข้อมูลหลัก",Translated
8446,"Max Amount Eligible","จำนวนเงินสูงสุดที่เข้าเกณฑ์",Translated
8452,"Max Benefit Amount","จำนวนเงินสวัสดิการสูงสุด",Translated
8457,"Max Benefit Amount (Yearly)","จำนวนเงินสวัสดิการสูงสุด (รายปี)",Translated
8463,"Max Benefits (Amount)","สวัสดิการสูงสุด (จำนวนเงิน)",Translated
8472,"Max Benefits (Yearly)","สวัสดิการสูงสุด (รายปี)",Translated
8476,"Max Exemption Amount","จำนวนเงินยกเว้นสูงสุด",Translated
8482,"Max Exemption Amount cannot be greater than maximum exemption amount {0} of Tax Exemption Category {1}","จำนวนเงินยกเว้นสูงสุดไม่สามารถมากกว่าจำนวนเงินยกเว้นสูงสุด {0} ของหมวดหมู่การยกเว้นภาษี {1}",Translated
8486,"Max Taxable Income","รายได้ที่ต้องเสียภาษีสูงสุด",Translated
8492,"Max benefits should be greater than zero to dispense benefits","สวัสดิการสูงสุดต้องมากกว่าศูนย์เพื่อจ่ายสวัสดิการ",Translated
8498,"Max working hours against Timesheet","ชั่วโมงทำงานสูงสุดเทียบกับไทม์ชีท",Translated
8503,"Maximum Carry Forwarded Leaves","จำนวนวันลาที่ยอดยกไปได้สูงสุด",Translated
8507,"Maximum Consecutive Leaves Allowed","จำนวนวันลาต่อเนื่องสูงสุดที่อนุญาต",Translated
8512,"Maximum Consecutive Leaves Exceeded","เกินจำนวนวันลาต่อเนื่องสูงสุด",Translated
8518,"Maximum Encashable Leaves","จำนวนวันลาสูงสุดที่แลกเป็นเงินสดได้",Translated
8524,"Maximum Exempted Amount","จำนวนเงินที่ได้รับการยกเว้นสูงสุด",Translated
8529,"Maximum Exemption Amount","จำนวนเงินยกเว้นสูงสุด",Translated
8533,"Maximum 
Leave Allocation Allowed per Leave Period","จำนวนการจัดสรรวันลาสูงสุดที่อนุญาตต่อรอบการลา",Translated
8539,"Maximum amount eligible for the component {0} exceeds {1}","จำนวนเงินสูงสุดที่เข้าเกณฑ์สำหรับองค์ประกอบ {0} เกิน {1}",Translated
8543,"Maximum annual taxable income eligible for full tax relief.
No tax is applied if income does not exceed this limit","รายได้ที่ต้องเสียภาษีสูงสุดต่อปีที่เข้าเกณฑ์การลดหย่อนภาษีเต็มจำนวน จะไม่มีการคิดภาษีหากรายได้ไม่เกินขีดจำกัดนี้",Translated
8548,"Maximum benefit amount of component {0} exceeds {1}","จำนวนเงินสวัสดิการสูงสุดขององค์ประกอบ {0} เกิน {1}",Translated
8552,"Maximum benefit amount of employee {0} exceeds {1}","จำนวนเงินสวัสดิการสูงสุดของพนักงาน {0} เกิน {1}",Translated
8556,"Maximum benefit of employee {0} exceeds {1} by the sum {2} of benefit application pro-rata component amount and previous claimed amount","สวัสดิการสูงสุดของพนักงาน {0} เกิน {1} ด้วยผลรวม {2} ของจำนวนเงินองค์ประกอบสวัสดิการตามสัดส่วนและจำนวนเงินที่เบิกก่อนหน้า",Translated
8560,"Maximum benefit of employee {0} exceeds {1} by the sum {2} of previous claimed amount","สวัสดิการสูงสุดของพนักงาน {0} เกิน {1} ด้วยผลรวม {2} ของจำนวนเงินที่เบิกก่อนหน้า",Translated
8564,"Maximum encashable leaves for {0} are {1}","จำนวนวันลาสูงสุดที่สามารถแลกเป็นเงินสดได้สำหรับ {0} คือ {1}",Translated
8569,"Maximum leave allowed in the leave type {0} is {1}","จำนวนวันลาสูงสุดที่อนุญาตในประเภทการลา {0} คือ {1}",Translated
8574,"May","พ.ค.",Translated
8578,"Meal Preference","ความต้องการด้านอาหาร",Translated
8582,"Medical","ทางการแพทย์",Translated
8591,"Menu","เมนู",Translated
8596,"Message","ข้อความ",Translated
8602,"Mileage","ระยะทาง",Translated
8608,"Min Taxable Income","รายได้ที่ต้องเสียภาษีขั้นต่ำ",Translated
8614,"Minimum Year for Gratuity","จำนวนปีขั้นต่ำสำหรับเงินบำเหน็จ",Translated
8618,"Minimum working days required since Date of Joining to apply for this leave","จำนวนวันทำงานขั้นต่ำที่ต้องการนับจากวันที่เริ่มงานเพื่อใช้ในการลาประเภทนี้",Translated
8623,"Missing Field","ฟิลด์ที่หายไป",Translated
8627,"Missing Fields","ฟิลด์ที่หายไป",Translated
8631,"Missing Mandatory Field","ฟิลด์ที่จำเป็นหายไป",Translated
8635,"Missing Opening Entries","ไม่พบรายการเปิดบัญชี",Translated
8639,"Missing Relieving Date","ไม่พบวันที่พ้นสภาพ",Translated
8644,"Missing 
Tax Slab","ไม่พบขั้นภาษี",Translated
8655,"Mode Of Payment","วิธีการชำระเงิน",Translated
8660,"Mode of Payment","วิธีการชำระเงิน",Translated
8664,"Mode of Travel","วิธีการเดินทาง",Translated
8670,"Mode of payment is required to make a payment","วิธีการชำระเงินเป็นสิ่งจำเป็นในการชำระเงิน",Translated
8675,"Model","รุ่น",Translated
8683,"Monday","วันจันทร์",Translated
8688,"Month","เดือน",Translated
8693,"Month To Date","ตั้งแต่ต้นเดือนจนถึงปัจจุบัน",Translated
8714,"Month To Date(Company Currency)","ตั้งแต่ต้นเดือนจนถึงปัจจุบัน (สกุลเงินบริษัท)",Translated
8723,"Monthly","รายเดือน",Translated
8727,"Monthly Attendance Sheet","ใบลงเวลาการเข้างานรายเดือน",Translated
8738,"More","เพิ่มเติม",Translated
8742,"More Info","ข้อมูลเพิ่มเติม",Translated
8746,"More than one selection for {0} not allowed","ไม่อนุญาตให้เลือก {0} มากกว่าหนึ่งรายการ",Translated
8750,"Multiple Additional Salaries with overwrite property exist for Salary Component {0} between {1} and {2}.","มีเงินเดือนเพิ่มเติมหลายรายการที่มีคุณสมบัติการเขียนทับสำหรับองค์ประกอบเงินเดือน {0} ระหว่าง {1} และ {2}",Translated
8754,"Multiple Shift Assignments","การมอบหมายกะหลายรายการ",Translated
8758,"My Account","บัญชีของฉัน",Translated
8762,"My Advances","เงินทดรองของฉัน",Translated
8766,"My Claims","การเบิกของฉัน",Translated
8770,"My Leaves","การลาของฉัน",Translated
8779,"My Requests","คำขอของฉัน",Translated
8784,"Name","ชื่อ",Translated
8789,"Name error","ชื่อผิดพลาด",Translated
8798,"Name of Organizer","ชื่อผู้จัด",Translated
8807,"Naming Series","ชุดการตั้งชื่อ",Translated
8812,"Net Pay","รายรับสุทธิ",Translated
8817,"Net Pay (Company Currency)","รายรับสุทธิ (สกุลเงินบริษัท)",Translated
8821,"Net Pay Info","ข้อมูลรายรับสุทธิ",Translated
8825,"Net Pay cannot be less than 0","รายรับสุทธิไม่สามารถน้อยกว่า 0",Translated
8829,"Net Salary Amount","จำนวนเงินเดือนสุทธิ",Translated
8837,"Net pay cannot be negative","รายรับสุทธิไม่สามารถติดลบได้",Translated
8842,"New","ใหม่",Translated
8847,"New Company","บริษัทใหม่",Translated
8851,"New Employee ID","รหัสพนักงานใหม่",Translated
8855,"New Expense Item","รายการค่าใช้จ่ายใหม่",Translated
8859,"New Expense Tax","ภาษีค่าใช้จ่ายใหม่",Translated
8863,"New Feedback","ข้อเสนอแนะใหม่",Translated
8869,"New Leave(s) Allocated","จัดสรรวันลาใหม่แล้ว",Translated
8874,"New Leaves Allocated","วันลาใหม่ที่จัดสรร",Translated
8880,"New Leaves Allocated (In Days)","วันลาใหม่ที่จัดสรร (เป็นวัน)",Translated
8884,"New shift assignments will be created after this date.","การมอบหมายกะใหม่จะถูกสร้างขึ้นหลังวันที่นี้",Translated
8892,"New {0}","{0} ใหม่",Translated
8897,"No","ไม่",Translated
8901,"No 
Data","ไม่มีข้อมูล",Translated
8905,"No Employee Found","ไม่พบพนักงาน",Translated
8909,"No Employee found for the given employee field value.
'{}': {}","ไม่พบพนักงานสำหรับค่าฟิลด์พนักงานที่ระบุ '{}': {}",Translated
8913,"No Employees Selected","ไม่ได้เลือกพนักงาน",Translated
8917,"No Interview has been scheduled.","ยังไม่มีการนัดหมายสัมภาษณ์",Translated
8921,"No Leave Period Found","ไม่พบรอบการลา",Translated
8925,"No Leaves Allocated to Employee: {0} for Leave Type: {1}","ไม่มีการจัดสรรวันลาให้พนักงาน: {0} สำหรับประเภทการลา: {1}",Translated
8929,"No Salary Slip found for Employee: {0}","ไม่พบสลิปเงินเดือนสำหรับพนักงาน: {0}",Translated
8933,"No Salary Structure Assignment found for employee {0} on or before {1}","ไม่พบการกำหนดโครงสร้างเงินเดือนสำหรับพนักงาน {0} ในหรือก่อนวันที่ {1}",Translated
8937,"No Salary Structure assigned to Employee {0} on the given date {1}","ไม่มีโครงสร้างเงินเดือนที่กำหนดให้กับพนักงาน {0} ในวันที่ที่ระบุ {1}",Translated
8941,"No Salary Structures","ไม่มีโครงสร้างเงินเดือน",Translated
8945,"No Shift Requests Selected","ไม่ได้เลือกคำขอกะ",Translated
8949,"No Staffing Plans found for this Designation","ไม่พบแผนการจัดหาบุคลากรสำหรับตำแหน่งนี้",Translated
8953,"No active employee found associated with the email ID {0}.
Try logging in with your employee email ID or contact your HR manager for access.","ไม่พบพนักงานที่ใช้งานอยู่ที่เชื่อมโยงกับรหัสอีเมล {0} โปรดลองเข้าสู่ระบบด้วยรหัสอีเมลพนักงานของคุณหรือติดต่อผู้จัดการฝ่ายบุคคลเพื่อขอเข้าถึง",Translated
8957,"No active or default Salary Structure found for employee {0} for the given dates","ไม่พบโครงสร้างเงินเดือนที่ใช้งานอยู่หรือเป็นค่าเริ่มต้นสำหรับพนักงาน {0} ในวันที่ที่ระบุ",Translated
8961,"No additional expenses has been added","ไม่มีการเพิ่มค่าใช้จ่ายเพิ่มเติม",Translated
8965,"No advances found","ไม่พบเงินทดรอง",Translated
8969,"No applicable Earning component found in last salary slip for Gratuity Rule: {0}","ไม่พบองค์ประกอบรายรับที่เกี่ยวข้องในสลิปเงินเดือนล่าสุดสำหรับกฎเงินบำเหน็จ: {0}",Translated
8973,"No applicable Earning components found for Gratuity Rule: {0}","ไม่พบองค์ประกอบรายรับที่เกี่ยวข้องสำหรับกฎเงินบำเหน็จ: {0}",Translated
8977,"No applicable slab found for the calculation of gratuity amount as per the Gratuity Rule: {0}","ไม่พบขั้นที่เกี่ยวข้องสำหรับการคำนวณจำนวนเงินบำเหน็จตามกฎเงินบำเหน็จ: {0}",Translated
8981,"No attendance records found for this criteria.","ไม่พบบันทึกการเข้างานสำหรับเกณฑ์นี้",Translated
8985,"No attendance records found.","ไม่พบบันทึกการเข้างาน",Translated
8989,"No attendance records to create","ไม่มีบันทึกการเข้างานที่จะสร้าง",Translated
8993,"No changes found in timings.","ไม่พบการเปลี่ยนแปลงในเวลา",Translated
8997,"No employees found","ไม่พบพนักงาน",Translated
9001,"No employees found for the mentioned criteria:<br>Company: {0}<br> Currency: {1}<br>Payroll Payable Account: 
{2}","ไม่พบพนักงานสำหรับเกณฑ์ที่ระบุ:<br>บริษัท: {0}<br> สกุลเงิน: {1}<br>บัญชีเงินเดือนค้างจ่าย: {2}",Translated
9005,"No employees found for the selected criteria","ไม่พบพนักงานสำหรับเกณฑ์ที่เลือก",Translated
9009,"No employees found with selected filters and active salary structure","ไม่พบพนักงานที่มีตัวกรองที่เลือกและโครงสร้างเงินเดือนที่ใช้งานอยู่",Translated
9013,"No expenses added","ไม่มีการเพิ่มค่าใช้จ่าย",Translated
9017,"No feedback has been received yet","ยังไม่ได้รับข้อเสนอแนะ",Translated
9021,"No items selected","ไม่ได้เลือกรายการ",Translated
9025,"No leave record found for employee {0} on {1}","ไม่พบบันทึกการลาสำหรับพนักงาน {0} ในวันที่ {1}",Translated
9029,"No leaves have been allocated.","ยังไม่มีการจัดสรรวันลา",Translated
9034,"No more updates","ไม่มีอัปเดตเพิ่มเติม",Translated
9038,"No of.
Positions","จำนวนตำแหน่ง",Translated
9042,"No record found","ไม่พบบันทึก",Translated
9046,"No replies from","ไม่มีการตอบกลับจาก",Translated
9050,"No salary slip found to submit for the above selected criteria OR salary slip already submitted","ไม่พบสลิปเงินเดือนที่จะส่งสำหรับเกณฑ์ที่เลือกข้างต้น หรือสลิปเงินเดือนได้ถูกส่งแล้ว",Translated
9054,"No salary slips found","ไม่พบสลิปเงินเดือน",Translated
9058,"No taxes added","ไม่มีการเพิ่มภาษี",Translated
9062,"No valid shift found for log time","ไม่พบกะที่ถูกต้องสำหรับเวลาที่บันทึก",Translated
9066,"No {0} Selected","ไม่ได้เลือก {0}",Translated
9070,"No {0} added","ไม่มีการเพิ่ม {0}",Translated
9076,"No {0} found","ไม่พบ {0}",Translated
9081,"Non Diary","ไม่ใช่บันทึกประจำวัน",Translated
9085,"Non Taxable Earnings","รายรับที่ไม่ต้องเสียภาษี",Translated
9089,"Non-Billed Hours","ชั่วโมงที่ไม่ได้เรียกเก็บเงิน",Translated
9094,"Non-Billed Hours (NB)","ชั่วโมงที่ไม่ได้เรียกเก็บเงิน (NB)",Translated
9100,"Non-Encashable Leaves","วันลาที่ไม่สามารถแลกเป็นเงินสดได้",Translated
9111,"Non-Vegetarian","ไม่ใช่มังสวิรัติ",Translated
9115,"Not Allowed","ไม่อนุญาต",Translated
9120,"Not Permitted","ไม่ได้รับอนุญาต",Translated
9124,"Not Started","ยังไม่ได้เริ่ม",Translated
9129,"Note","หมายเหตุ",Translated
9133,"Note: Shift will not be overwritten in existing attendance records","หมายเหตุ: กะจะไม่ถูกเขียนทับในบันทึกการเข้างานที่มีอยู่",Translated
9137,"Note: Total allocated leaves {0} shouldn't be less than already approved leaves {1} for the period","หมายเหตุ: จำนวนวันลาที่จัดสรรทั้งหมด {0} ไม่ควรน้อยกว่าจำนวนวันลาที่อนุมัติแล้ว {1} สำหรับรอบเวลานั้น",Translated
9144,""Note: Your salary slip is password protected, the password to unlock the PDF is of the format {0}."",""หมายเหตุ: สลิปเงินเดือนของคุณมีการป้องกันด้วยรหัสผ่าน รหัสผ่านเพื่อปลดล็อก PDF อยู่ในรูปแบบ {0}"",Translated
9148,"Notes","บันทึก",Translated
